{
  "schema_version": "contextdb.release-bundle-input/v1",
  "release": {
    "version": "0.2.0-alpha.1",
    "channel": "development",
    "created_at": "2026-08-12T00:00:00Z",
    "candidate": 1
  },
  "source": {
    "repository": "https://example.invalid/contextdb",
    "git_commit": "0000000000000000000000000000000000000000",
    "dirty": true
  },
  "version_manifest": {
    "source_path": "inputs/release/version.json",
    "path": "release/version.json",
    "sha256": "0000000000000000000000000000000000000000000000000000000000000000",
    "size_bytes": 0,
    "media_type": "application/json"
  },
  "proof_index": {
    "source_path": "inputs/release/proof-index.json",
    "path": "release/proof-index.json",
    "sha256": "0000000000000000000000000000000000000000000000000000000000000000",
    "size_bytes": 0,
    "media_type": "application/json"
  },
  "artifacts": [
    {
      "id": "benchmark-dataset-placeholder",
      "package_id": "benchmark-datasets",
      "roles": [
        "benchmark-datasets"
      ],
      "kind": "benchmark-dataset",
      "source_path": "inputs/artifacts/benchmark-dataset.json",
      "path": "artifacts/benchmark-datasets/benchmark-dataset.json",
      "media_type": "application/json",
      "size_bytes": 0,
      "sha256": "0000000000000000000000000000000000000000000000000000000000000000",
      "targets": [
        "platform-independent"
      ],
      "version": "0.2.0-alpha.1",
      "provenance": {
        "source_commit": "0000000000000000000000000000000000000000",
        "builder": "placeholder-not-built",
        "build_recipe": "release/package-matrix.json",
        "reproducible": false
      },
      "related_files": []
    }
  ],
  "supporting_files": [],
  "limitations": [
    "Schema example only: every digest and byte count is a placeholder.",
    "The dirty all-zero source revision and placeholder builder are deliberately non-releasable.",
    "Replace every input reference with an existing verified file before assembly."
  ]
}
